No.     Time           Source                Destination           Protocol Length Info
      1 0.000000       192.168.2.49          99.236.34.223         TCP      66     18603 → 50008 [SYN] Seq=0 Win=64240 Len=0 MSS=1460 WS=256 SACK_PERM

Frame 1: 66 bytes on wire (528 bits), 66 bytes captured (528 bits) on interface \Device\NPF_{F3023D06-108F-4190-A8B5-7A0A1D9213BD}, id 0
Ethernet II, Src: Micro-St_92:7c:77 (d8:bb:c1:92:7c:77), Dst: Sagemcom_fc:fd:c0 (98:42:65:fc:fd:c0)
Internet Protocol Version 4, Src: 192.168.2.49, Dst: 99.236.34.223
Transmission Control Protocol, Src Port: 18603, Dst Port: 50008, Seq: 0, Len: 0

No.     Time           Source                Destination           Protocol Length Info
      2 0.000006       192.168.2.49          99.236.34.223         TCP      66     [TCP Retransmission] [TCP Port numbers reused] 18603 → 50008 [SYN] Seq=0 Win=64240 Len=0 MSS=1460 WS=256 SACK_PERM

Frame 2: 66 bytes on wire (528 bits), 66 bytes captured (528 bits) on interface \Device\NPF_{F3023D06-108F-4190-A8B5-7A0A1D9213BD}, id 0
Ethernet II, Src: Micro-St_92:7c:77 (d8:bb:c1:92:7c:77), Dst: Sagemcom_fc:fd:c0 (98:42:65:fc:fd:c0)
Internet Protocol Version 4, Src: 192.168.2.49, Dst: 99.236.34.223
Transmission Control Protocol, Src Port: 18603, Dst Port: 50008, Seq: 0, Len: 0

No.     Time           Source                Destination           Protocol Length Info
      3 0.022323       99.236.34.223         192.168.2.49          TCP      66     50008 → 18603 [SYN, ACK] Seq=0 Ack=1 Win=64240 Len=0 MSS=1452 SACK_PERM WS=128

Frame 3: 66 bytes on wire (528 bits), 66 bytes captured (528 bits) on interface \Device\NPF_{F3023D06-108F-4190-A8B5-7A0A1D9213BD}, id 0
Ethernet II, Src: Sagemcom_fc:fd:c0 (98:42:65:fc:fd:c0), Dst: Micro-St_92:7c:77 (d8:bb:c1:92:7c:77)
Internet Protocol Version 4, Src: 99.236.34.223, Dst: 192.168.2.49
Transmission Control Protocol, Src Port: 50008, Dst Port: 18603, Seq: 0, Ack: 1, Len: 0

No.     Time           Source                Destination           Protocol Length Info
      4 0.022373       192.168.2.49          99.236.34.223         TCP      54     18603 → 50008 [ACK] Seq=1 Ack=1 Win=132096 Len=0

Frame 4: 54 bytes on wire (432 bits), 54 bytes captured (432 bits) on interface \Device\NPF_{F3023D06-108F-4190-A8B5-7A0A1D9213BD}, id 0
Ethernet II, Src: Micro-St_92:7c:77 (d8:bb:c1:92:7c:77), Dst: Sagemcom_fc:fd:c0 (98:42:65:fc:fd:c0)
Internet Protocol Version 4, Src: 192.168.2.49, Dst: 99.236.34.223
Transmission Control Protocol, Src Port: 18603, Dst Port: 50008, Seq: 1, Ack: 1, Len: 0

No.     Time           Source                Destination           Protocol Length Info
      5 0.022379       192.168.2.49          99.236.34.223         TCP      54     [TCP Dup ACK 4#1] 18603 → 50008 [ACK] Seq=1 Ack=1 Win=132096 Len=0

Frame 5: 54 bytes on wire (432 bits), 54 bytes captured (432 bits) on interface \Device\NPF_{F3023D06-108F-4190-A8B5-7A0A1D9213BD}, id 0
Ethernet II, Src: Micro-St_92:7c:77 (d8:bb:c1:92:7c:77), Dst: Sagemcom_fc:fd:c0 (98:42:65:fc:fd:c0)
Internet Protocol Version 4, Src: 192.168.2.49, Dst: 99.236.34.223
Transmission Control Protocol, Src Port: 18603, Dst Port: 50008, Seq: 1, Ack: 1, Len: 0

No.     Time           Source                Destination           Protocol Length Info
      6 0.023272       192.168.2.49          99.236.34.223         TLSv1    571    Client Hello

Frame 6: 571 bytes on wire (4568 bits), 571 bytes captured (4568 bits) on interface \Device\NPF_{F3023D06-108F-4190-A8B5-7A0A1D9213BD}, id 0
Ethernet II, Src: Micro-St_92:7c:77 (d8:bb:c1:92:7c:77), Dst: Sagemcom_fc:fd:c0 (98:42:65:fc:fd:c0)
Internet Protocol Version 4, Src: 192.168.2.49, Dst: 99.236.34.223
Transmission Control Protocol, Src Port: 18603, Dst Port: 50008, Seq: 1, Ack: 1, Len: 517
Transport Layer Security

No.     Time           Source                Destination           Protocol Length Info
      7 0.023280       192.168.2.49          99.236.34.223         TCP      571    [TCP Retransmission] 18603 → 50008 [PSH, ACK] Seq=1 Ack=1 Win=132096 Len=517

Frame 7: 571 bytes on wire (4568 bits), 571 bytes captured (4568 bits) on interface \Device\NPF_{F3023D06-108F-4190-A8B5-7A0A1D9213BD}, id 0
Ethernet II, Src: Micro-St_92:7c:77 (d8:bb:c1:92:7c:77), Dst: Sagemcom_fc:fd:c0 (98:42:65:fc:fd:c0)
Internet Protocol Version 4, Src: 192.168.2.49, Dst: 99.236.34.223
Transmission Control Protocol, Src Port: 18603, Dst Port: 50008, Seq: 1, Ack: 1, Len: 517

No.     Time           Source                Destination           Protocol Length Info
      8 0.048572       99.236.34.223         192.168.2.49          TCP      60     50008 → 18603 [ACK] Seq=1 Ack=518 Win=64128 Len=0

Frame 8: 60 bytes on wire (480 bits), 60 bytes captured (480 bits) on interface \Device\NPF_{F3023D06-108F-4190-A8B5-7A0A1D9213BD}, id 0
Ethernet II, Src: Sagemcom_fc:fd:c0 (98:42:65:fc:fd:c0), Dst: Micro-St_92:7c:77 (d8:bb:c1:92:7c:77)
Internet Protocol Version 4, Src: 99.236.34.223, Dst: 192.168.2.49
Transmission Control Protocol, Src Port: 50008, Dst Port: 18603, Seq: 1, Ack: 518, Len: 0

No.     Time           Source                Destination           Protocol Length Info
      9 0.057238       99.236.34.223         192.168.2.49          HTTP     537    HTTP/1.1 400 Bad Request  (text/html)

Frame 9: 537 bytes on wire (4296 bits), 537 bytes captured (4296 bits) on interface \Device\NPF_{F3023D06-108F-4190-A8B5-7A0A1D9213BD}, id 0
Ethernet II, Src: Sagemcom_fc:fd:c0 (98:42:65:fc:fd:c0), Dst: Micro-St_92:7c:77 (d8:bb:c1:92:7c:77)
Internet Protocol Version 4, Src: 99.236.34.223, Dst: 192.168.2.49
Transmission Control Protocol, Src Port: 50008, Dst Port: 18603, Seq: 1, Ack: 518, Len: 483
Hypertext Transfer Protocol
Line-based text data: text/html (10 lines)

No.     Time           Source                Destination           Protocol Length Info
     10 0.057239       99.236.34.223         192.168.2.49          TCP      60     50008 → 18603 [FIN, ACK] Seq=484 Ack=518 Win=64128 Len=0

Frame 10: 60 bytes on wire (480 bits), 60 bytes captured (480 bits) on interface \Device\NPF_{F3023D06-108F-4190-A8B5-7A0A1D9213BD}, id 0
Ethernet II, Src: Sagemcom_fc:fd:c0 (98:42:65:fc:fd:c0), Dst: Micro-St_92:7c:77 (d8:bb:c1:92:7c:77)
Internet Protocol Version 4, Src: 99.236.34.223, Dst: 192.168.2.49
Transmission Control Protocol, Src Port: 50008, Dst Port: 18603, Seq: 484, Ack: 518, Len: 0

No.     Time           Source                Destination           Protocol Length Info
     11 0.057278       192.168.2.49          99.236.34.223         TCP      54     18603 → 50008 [ACK] Seq=518 Ack=485 Win=131584 Len=0

Frame 11: 54 bytes on wire (432 bits), 54 bytes captured (432 bits) on interface \Device\NPF_{F3023D06-108F-4190-A8B5-7A0A1D9213BD}, id 0
Ethernet II, Src: Micro-St_92:7c:77 (d8:bb:c1:92:7c:77), Dst: Sagemcom_fc:fd:c0 (98:42:65:fc:fd:c0)
Internet Protocol Version 4, Src: 192.168.2.49, Dst: 99.236.34.223
Transmission Control Protocol, Src Port: 18603, Dst Port: 50008, Seq: 518, Ack: 485, Len: 0

No.     Time           Source                Destination           Protocol Length Info
     12 0.057288       192.168.2.49          99.236.34.223         TCP      54     [TCP Dup ACK 11#1] 18603 → 50008 [ACK] Seq=518 Ack=485 Win=131584 Len=0

Frame 12: 54 bytes on wire (432 bits), 54 bytes captured (432 bits) on interface \Device\NPF_{F3023D06-108F-4190-A8B5-7A0A1D9213BD}, id 0
Ethernet II, Src: Micro-St_92:7c:77 (d8:bb:c1:92:7c:77), Dst: Sagemcom_fc:fd:c0 (98:42:65:fc:fd:c0)
Internet Protocol Version 4, Src: 192.168.2.49, Dst: 99.236.34.223
Transmission Control Protocol, Src Port: 18603, Dst Port: 50008, Seq: 518, Ack: 485, Len: 0

No.     Time           Source                Destination           Protocol Length Info
     13 0.057303       192.168.2.49          99.236.34.223         TCP      61     18603 → 50008 [PSH, ACK] Seq=518 Ack=485 Win=131584 Len=7

Frame 13: 61 bytes on wire (488 bits), 61 bytes captured (488 bits) on interface \Device\NPF_{F3023D06-108F-4190-A8B5-7A0A1D9213BD}, id 0
Ethernet II, Src: Micro-St_92:7c:77 (d8:bb:c1:92:7c:77), Dst: Sagemcom_fc:fd:c0 (98:42:65:fc:fd:c0)
Internet Protocol Version 4, Src: 192.168.2.49, Dst: 99.236.34.223
Transmission Control Protocol, Src Port: 18603, Dst Port: 50008, Seq: 518, Ack: 485, Len: 7

No.     Time           Source                Destination           Protocol Length Info
     14 0.057398       192.168.2.49          99.236.34.223         TCP      54     18603 → 50008 [RST, ACK] Seq=525 Ack=485 Win=0 Len=0

Frame 14: 54 bytes on wire (432 bits), 54 bytes captured (432 bits) on interface \Device\NPF_{F3023D06-108F-4190-A8B5-7A0A1D9213BD}, id 0
Ethernet II, Src: Micro-St_92:7c:77 (d8:bb:c1:92:7c:77), Dst: Sagemcom_fc:fd:c0 (98:42:65:fc:fd:c0)
Internet Protocol Version 4, Src: 192.168.2.49, Dst: 99.236.34.223
Transmission Control Protocol, Src Port: 18603, Dst Port: 50008, Seq: 525, Ack: 485, Len: 0

No.     Time           Source                Destination           Protocol Length Info
     15 0.057402       192.168.2.49          99.236.34.223         TCP      54     18603 → 50008 [RST, ACK] Seq=525 Ack=485 Win=0 Len=0

Frame 15: 54 bytes on wire (432 bits), 54 bytes captured (432 bits) on interface \Device\NPF_{F3023D06-108F-4190-A8B5-7A0A1D9213BD}, id 0
Ethernet II, Src: Micro-St_92:7c:77 (d8:bb:c1:92:7c:77), Dst: Sagemcom_fc:fd:c0 (98:42:65:fc:fd:c0)
Internet Protocol Version 4, Src: 192.168.2.49, Dst: 99.236.34.223
Transmission Control Protocol, Src Port: 18603, Dst Port: 50008, Seq: 525, Ack: 485, Len: 0

No.     Time           Source                Destination           Protocol Length Info
     16 3.545148       192.168.2.49          99.236.34.223         TCP      66     18604 → 50008 [SYN] Seq=0 Win=64240 Len=0 MSS=1460 WS=256 SACK_PERM

Frame 16: 66 bytes on wire (528 bits), 66 bytes captured (528 bits) on interface \Device\NPF_{F3023D06-108F-4190-A8B5-7A0A1D9213BD}, id 0
Ethernet II, Src: Micro-St_92:7c:77 (d8:bb:c1:92:7c:77), Dst: Sagemcom_fc:fd:c0 (98:42:65:fc:fd:c0)
Internet Protocol Version 4, Src: 192.168.2.49, Dst: 99.236.34.223
Transmission Control Protocol, Src Port: 18604, Dst Port: 50008, Seq: 0, Len: 0

No.     Time           Source                Destination           Protocol Length Info
     17 3.545156       192.168.2.49          99.236.34.223         TCP      66     [TCP Retransmission] [TCP Port numbers reused] 18604 → 50008 [SYN] Seq=0 Win=64240 Len=0 MSS=1460 WS=256 SACK_PERM

Frame 17: 66 bytes on wire (528 bits), 66 bytes captured (528 bits) on interface \Device\NPF_{F3023D06-108F-4190-A8B5-7A0A1D9213BD}, id 0
Ethernet II, Src: Micro-St_92:7c:77 (d8:bb:c1:92:7c:77), Dst: Sagemcom_fc:fd:c0 (98:42:65:fc:fd:c0)
Internet Protocol Version 4, Src: 192.168.2.49, Dst: 99.236.34.223
Transmission Control Protocol, Src Port: 18604, Dst Port: 50008, Seq: 0, Len: 0

No.     Time           Source                Destination           Protocol Length Info
     18 3.572087       99.236.34.223         192.168.2.49          TCP      66     50008 → 18604 [SYN, ACK] Seq=0 Ack=1 Win=64240 Len=0 MSS=1452 SACK_PERM WS=128

Frame 18: 66 bytes on wire (528 bits), 66 bytes captured (528 bits) on interface \Device\NPF_{F3023D06-108F-4190-A8B5-7A0A1D9213BD}, id 0
Ethernet II, Src: Sagemcom_fc:fd:c0 (98:42:65:fc:fd:c0), Dst: Micro-St_92:7c:77 (d8:bb:c1:92:7c:77)
Internet Protocol Version 4, Src: 99.236.34.223, Dst: 192.168.2.49
Transmission Control Protocol, Src Port: 50008, Dst Port: 18604, Seq: 0, Ack: 1, Len: 0

No.     Time           Source                Destination           Protocol Length Info
     19 3.572135       192.168.2.49          99.236.34.223         TCP      54     18604 → 50008 [ACK] Seq=1 Ack=1 Win=132096 Len=0

Frame 19: 54 bytes on wire (432 bits), 54 bytes captured (432 bits) on interface \Device\NPF_{F3023D06-108F-4190-A8B5-7A0A1D9213BD}, id 0
Ethernet II, Src: Micro-St_92:7c:77 (d8:bb:c1:92:7c:77), Dst: Sagemcom_fc:fd:c0 (98:42:65:fc:fd:c0)
Internet Protocol Version 4, Src: 192.168.2.49, Dst: 99.236.34.223
Transmission Control Protocol, Src Port: 18604, Dst Port: 50008, Seq: 1, Ack: 1, Len: 0

No.     Time           Source                Destination           Protocol Length Info
     20 3.572141       192.168.2.49          99.236.34.223         TCP      54     [TCP Dup ACK 19#1] 18604 → 50008 [ACK] Seq=1 Ack=1 Win=132096 Len=0

Frame 20: 54 bytes on wire (432 bits), 54 bytes captured (432 bits) on interface \Device\NPF_{F3023D06-108F-4190-A8B5-7A0A1D9213BD}, id 0
Ethernet II, Src: Micro-St_92:7c:77 (d8:bb:c1:92:7c:77), Dst: Sagemcom_fc:fd:c0 (98:42:65:fc:fd:c0)
Internet Protocol Version 4, Src: 192.168.2.49, Dst: 99.236.34.223
Transmission Control Protocol, Src Port: 18604, Dst Port: 50008, Seq: 1, Ack: 1, Len: 0

No.     Time           Source                Destination           Protocol Length Info
     21 3.572288       192.168.2.49          99.236.34.223         HTTP     429    GET /photos/ HTTP/1.1 

Frame 21: 429 bytes on wire (3432 bits), 429 bytes captured (3432 bits) on interface \Device\NPF_{F3023D06-108F-4190-A8B5-7A0A1D9213BD}, id 0
Ethernet II, Src: Micro-St_92:7c:77 (d8:bb:c1:92:7c:77), Dst: Sagemcom_fc:fd:c0 (98:42:65:fc:fd:c0)
Internet Protocol Version 4, Src: 192.168.2.49, Dst: 99.236.34.223
Transmission Control Protocol, Src Port: 18604, Dst Port: 50008, Seq: 1, Ack: 1, Len: 375
Hypertext Transfer Protocol

No.     Time           Source                Destination           Protocol Length Info
     22 3.572293       192.168.2.49          99.236.34.223         TCP      429    [TCP Retransmission] 18604 → 50008 [PSH, ACK] Seq=1 Ack=1 Win=132096 Len=375

Frame 22: 429 bytes on wire (3432 bits), 429 bytes captured (3432 bits) on interface \Device\NPF_{F3023D06-108F-4190-A8B5-7A0A1D9213BD}, id 0
Ethernet II, Src: Micro-St_92:7c:77 (d8:bb:c1:92:7c:77), Dst: Sagemcom_fc:fd:c0 (98:42:65:fc:fd:c0)
Internet Protocol Version 4, Src: 192.168.2.49, Dst: 99.236.34.223
Transmission Control Protocol, Src Port: 18604, Dst Port: 50008, Seq: 1, Ack: 1, Len: 375

No.     Time           Source                Destination           Protocol Length Info
     23 3.597137       99.236.34.223         192.168.2.49          TCP      60     50008 → 18604 [ACK] Seq=1 Ack=376 Win=64128 Len=0

Frame 23: 60 bytes on wire (480 bits), 60 bytes captured (480 bits) on interface \Device\NPF_{F3023D06-108F-4190-A8B5-7A0A1D9213BD}, id 0
Ethernet II, Src: Sagemcom_fc:fd:c0 (98:42:65:fc:fd:c0), Dst: Micro-St_92:7c:77 (d8:bb:c1:92:7c:77)
Internet Protocol Version 4, Src: 99.236.34.223, Dst: 192.168.2.49
Transmission Control Protocol, Src Port: 50008, Dst Port: 18604, Seq: 1, Ack: 376, Len: 0

No.     Time           Source                Destination           Protocol Length Info
     24 3.603848       99.236.34.223         192.168.2.49          HTTP     969    HTTP/1.1 200 OK  (text/html)

Frame 24: 969 bytes on wire (7752 bits), 969 bytes captured (7752 bits) on interface \Device\NPF_{F3023D06-108F-4190-A8B5-7A0A1D9213BD}, id 0
Ethernet II, Src: Sagemcom_fc:fd:c0 (98:42:65:fc:fd:c0), Dst: Micro-St_92:7c:77 (d8:bb:c1:92:7c:77)
Internet Protocol Version 4, Src: 99.236.34.223, Dst: 192.168.2.49
Transmission Control Protocol, Src Port: 50008, Dst Port: 18604, Seq: 1, Ack: 376, Len: 915
Hypertext Transfer Protocol
Line-based text data: text/html (35 lines)

No.     Time           Source                Destination           Protocol Length Info
     25 3.628921       192.168.2.49          99.236.34.223         HTTP     399    GET /icons/blank.gif HTTP/1.1 

Frame 25: 399 bytes on wire (3192 bits), 399 bytes captured (3192 bits) on interface \Device\NPF_{F3023D06-108F-4190-A8B5-7A0A1D9213BD}, id 0
Ethernet II, Src: Micro-St_92:7c:77 (d8:bb:c1:92:7c:77), Dst: Sagemcom_fc:fd:c0 (98:42:65:fc:fd:c0)
Internet Protocol Version 4, Src: 192.168.2.49, Dst: 99.236.34.223
Transmission Control Protocol, Src Port: 18604, Dst Port: 50008, Seq: 376, Ack: 916, Len: 345
Hypertext Transfer Protocol

No.     Time           Source                Destination           Protocol Length Info
     26 3.628929       192.168.2.49          99.236.34.223         TCP      399    [TCP Retransmission] 18604 → 50008 [PSH, ACK] Seq=376 Ack=916 Win=131072 Len=345

Frame 26: 399 bytes on wire (3192 bits), 399 bytes captured (3192 bits) on interface \Device\NPF_{F3023D06-108F-4190-A8B5-7A0A1D9213BD}, id 0
Ethernet II, Src: Micro-St_92:7c:77 (d8:bb:c1:92:7c:77), Dst: Sagemcom_fc:fd:c0 (98:42:65:fc:fd:c0)
Internet Protocol Version 4, Src: 192.168.2.49, Dst: 99.236.34.223
Transmission Control Protocol, Src Port: 18604, Dst Port: 50008, Seq: 376, Ack: 916, Len: 345

No.     Time           Source                Destination           Protocol Length Info
     27 3.629313       192.168.2.49          99.236.34.223         TCP      66     18605 → 50008 [SYN] Seq=0 Win=64240 Len=0 MSS=1460 WS=256 SACK_PERM

Frame 27: 66 bytes on wire (528 bits), 66 bytes captured (528 bits) on interface \Device\NPF_{F3023D06-108F-4190-A8B5-7A0A1D9213BD}, id 0
Ethernet II, Src: Micro-St_92:7c:77 (d8:bb:c1:92:7c:77), Dst: Sagemcom_fc:fd:c0 (98:42:65:fc:fd:c0)
Internet Protocol Version 4, Src: 192.168.2.49, Dst: 99.236.34.223
Transmission Control Protocol, Src Port: 18605, Dst Port: 50008, Seq: 0, Len: 0

No.     Time           Source                Destination           Protocol Length Info
     28 3.629318       192.168.2.49          99.236.34.223         TCP      66     [TCP Retransmission] [TCP Port numbers reused] 18605 → 50008 [SYN] Seq=0 Win=64240 Len=0 MSS=1460 WS=256 SACK_PERM

Frame 28: 66 bytes on wire (528 bits), 66 bytes captured (528 bits) on interface \Device\NPF_{F3023D06-108F-4190-A8B5-7A0A1D9213BD}, id 0
Ethernet II, Src: Micro-St_92:7c:77 (d8:bb:c1:92:7c:77), Dst: Sagemcom_fc:fd:c0 (98:42:65:fc:fd:c0)
Internet Protocol Version 4, Src: 192.168.2.49, Dst: 99.236.34.223
Transmission Control Protocol, Src Port: 18605, Dst Port: 50008, Seq: 0, Len: 0

No.     Time           Source                Destination           Protocol Length Info
     29 3.629486       192.168.2.49          99.236.34.223         TCP      66     18606 → 50008 [SYN] Seq=0 Win=64240 Len=0 MSS=1460 WS=256 SACK_PERM

Frame 29: 66 bytes on wire (528 bits), 66 bytes captured (528 bits) on interface \Device\NPF_{F3023D06-108F-4190-A8B5-7A0A1D9213BD}, id 0
Ethernet II, Src: Micro-St_92:7c:77 (d8:bb:c1:92:7c:77), Dst: Sagemcom_fc:fd:c0 (98:42:65:fc:fd:c0)
Internet Protocol Version 4, Src: 192.168.2.49, Dst: 99.236.34.223
Transmission Control Protocol, Src Port: 18606, Dst Port: 50008, Seq: 0, Len: 0

No.     Time           Source                Destination           Protocol Length Info
     30 3.629489       192.168.2.49          99.236.34.223         TCP      66     [TCP Retransmission] [TCP Port numbers reused] 18606 → 50008 [SYN] Seq=0 Win=64240 Len=0 MSS=1460 WS=256 SACK_PERM

Frame 30: 66 bytes on wire (528 bits), 66 bytes captured (528 bits) on interface \Device\NPF_{F3023D06-108F-4190-A8B5-7A0A1D9213BD}, id 0
Ethernet II, Src: Micro-St_92:7c:77 (d8:bb:c1:92:7c:77), Dst: Sagemcom_fc:fd:c0 (98:42:65:fc:fd:c0)
Internet Protocol Version 4, Src: 192.168.2.49, Dst: 99.236.34.223
Transmission Control Protocol, Src Port: 18606, Dst Port: 50008, Seq: 0, Len: 0

No.     Time           Source                Destination           Protocol Length Info
     31 3.651206       99.236.34.223         192.168.2.49          HTTP     485    HTTP/1.1 200 OK  (GIF89a)

Frame 31: 485 bytes on wire (3880 bits), 485 bytes captured (3880 bits) on interface \Device\NPF_{F3023D06-108F-4190-A8B5-7A0A1D9213BD}, id 0
Ethernet II, Src: Sagemcom_fc:fd:c0 (98:42:65:fc:fd:c0), Dst: Micro-St_92:7c:77 (d8:bb:c1:92:7c:77)
Internet Protocol Version 4, Src: 99.236.34.223, Dst: 192.168.2.49
Transmission Control Protocol, Src Port: 50008, Dst Port: 18604, Seq: 916, Ack: 721, Len: 431
Hypertext Transfer Protocol
Compuserve GIF, Version: GIF89a

No.     Time           Source                Destination           Protocol Length Info
     32 3.651370       192.168.2.49          99.236.34.223         HTTP     398    GET /icons/back.gif HTTP/1.1 

Frame 32: 398 bytes on wire (3184 bits), 398 bytes captured (3184 bits) on interface \Device\NPF_{F3023D06-108F-4190-A8B5-7A0A1D9213BD}, id 0
Ethernet II, Src: Micro-St_92:7c:77 (d8:bb:c1:92:7c:77), Dst: Sagemcom_fc:fd:c0 (98:42:65:fc:fd:c0)
Internet Protocol Version 4, Src: 192.168.2.49, Dst: 99.236.34.223
Transmission Control Protocol, Src Port: 18604, Dst Port: 50008, Seq: 721, Ack: 1347, Len: 344
Hypertext Transfer Protocol

No.     Time           Source                Destination           Protocol Length Info
     33 3.651376       192.168.2.49          99.236.34.223         TCP      398    [TCP Retransmission] 18604 → 50008 [PSH, ACK] Seq=721 Ack=1347 Win=130560 Len=344

Frame 33: 398 bytes on wire (3184 bits), 398 bytes captured (3184 bits) on interface \Device\NPF_{F3023D06-108F-4190-A8B5-7A0A1D9213BD}, id 0
Ethernet II, Src: Micro-St_92:7c:77 (d8:bb:c1:92:7c:77), Dst: Sagemcom_fc:fd:c0 (98:42:65:fc:fd:c0)
Internet Protocol Version 4, Src: 192.168.2.49, Dst: 99.236.34.223
Transmission Control Protocol, Src Port: 18604, Dst Port: 50008, Seq: 721, Ack: 1347, Len: 344

No.     Time           Source                Destination           Protocol Length Info
     34 3.661030       99.236.34.223         192.168.2.49          TCP      66     50008 → 18605 [SYN, ACK] Seq=0 Ack=1 Win=64240 Len=0 MSS=1452 SACK_PERM WS=128

Frame 34: 66 bytes on wire (528 bits), 66 bytes captured (528 bits) on interface \Device\NPF_{F3023D06-108F-4190-A8B5-7A0A1D9213BD}, id 0
Ethernet II, Src: Sagemcom_fc:fd:c0 (98:42:65:fc:fd:c0), Dst: Micro-St_92:7c:77 (d8:bb:c1:92:7c:77)
Internet Protocol Version 4, Src: 99.236.34.223, Dst: 192.168.2.49
Transmission Control Protocol, Src Port: 50008, Dst Port: 18605, Seq: 0, Ack: 1, Len: 0

No.     Time           Source                Destination           Protocol Length Info
     35 3.661073       192.168.2.49          99.236.34.223         TCP      54     18605 → 50008 [ACK] Seq=1 Ack=1 Win=132096 Len=0

Frame 35: 54 bytes on wire (432 bits), 54 bytes captured (432 bits) on interface \Device\NPF_{F3023D06-108F-4190-A8B5-7A0A1D9213BD}, id 0
Ethernet II, Src: Micro-St_92:7c:77 (d8:bb:c1:92:7c:77), Dst: Sagemcom_fc:fd:c0 (98:42:65:fc:fd:c0)
Internet Protocol Version 4, Src: 192.168.2.49, Dst: 99.236.34.223
Transmission Control Protocol, Src Port: 18605, Dst Port: 50008, Seq: 1, Ack: 1, Len: 0

No.     Time           Source                Destination           Protocol Length Info
     36 3.661079       192.168.2.49          99.236.34.223         TCP      54     [TCP Dup ACK 35#1] 18605 → 50008 [ACK] Seq=1 Ack=1 Win=132096 Len=0

Frame 36: 54 bytes on wire (432 bits), 54 bytes captured (432 bits) on interface \Device\NPF_{F3023D06-108F-4190-A8B5-7A0A1D9213BD}, id 0
Ethernet II, Src: Micro-St_92:7c:77 (d8:bb:c1:92:7c:77), Dst: Sagemcom_fc:fd:c0 (98:42:65:fc:fd:c0)
Internet Protocol Version 4, Src: 192.168.2.49, Dst: 99.236.34.223
Transmission Control Protocol, Src Port: 18605, Dst Port: 50008, Seq: 1, Ack: 1, Len: 0

No.     Time           Source                Destination           Protocol Length Info
     37 3.661174       192.168.2.49          99.236.34.223         HTTP     400    GET /icons/image2.gif HTTP/1.1 

Frame 37: 400 bytes on wire (3200 bits), 400 bytes captured (3200 bits) on interface \Device\NPF_{F3023D06-108F-4190-A8B5-7A0A1D9213BD}, id 0
Ethernet II, Src: Micro-St_92:7c:77 (d8:bb:c1:92:7c:77), Dst: Sagemcom_fc:fd:c0 (98:42:65:fc:fd:c0)
Internet Protocol Version 4, Src: 192.168.2.49, Dst: 99.236.34.223
Transmission Control Protocol, Src Port: 18605, Dst Port: 50008, Seq: 1, Ack: 1, Len: 346
Hypertext Transfer Protocol

No.     Time           Source                Destination           Protocol Length Info
     38 3.661178       192.168.2.49          99.236.34.223         TCP      400    [TCP Retransmission] 18605 → 50008 [PSH, ACK] Seq=1 Ack=1 Win=132096 Len=346

Frame 38: 400 bytes on wire (3200 bits), 400 bytes captured (3200 bits) on interface \Device\NPF_{F3023D06-108F-4190-A8B5-7A0A1D9213BD}, id 0
Ethernet II, Src: Micro-St_92:7c:77 (d8:bb:c1:92:7c:77), Dst: Sagemcom_fc:fd:c0 (98:42:65:fc:fd:c0)
Internet Protocol Version 4, Src: 192.168.2.49, Dst: 99.236.34.223
Transmission Control Protocol, Src Port: 18605, Dst Port: 50008, Seq: 1, Ack: 1, Len: 346

No.     Time           Source                Destination           Protocol Length Info
     39 3.665750       99.236.34.223         192.168.2.49          TCP      66     50008 → 18606 [SYN, ACK] Seq=0 Ack=1 Win=64240 Len=0 MSS=1452 SACK_PERM WS=128

Frame 39: 66 bytes on wire (528 bits), 66 bytes captured (528 bits) on interface \Device\NPF_{F3023D06-108F-4190-A8B5-7A0A1D9213BD}, id 0
Ethernet II, Src: Sagemcom_fc:fd:c0 (98:42:65:fc:fd:c0), Dst: Micro-St_92:7c:77 (d8:bb:c1:92:7c:77)
Internet Protocol Version 4, Src: 99.236.34.223, Dst: 192.168.2.49
Transmission Control Protocol, Src Port: 50008, Dst Port: 18606, Seq: 0, Ack: 1, Len: 0

No.     Time           Source                Destination           Protocol Length Info
     40 3.665789       192.168.2.49          99.236.34.223         TCP      54     18606 → 50008 [ACK] Seq=1 Ack=1 Win=132096 Len=0

Frame 40: 54 bytes on wire (432 bits), 54 bytes captured (432 bits) on interface \Device\NPF_{F3023D06-108F-4190-A8B5-7A0A1D9213BD}, id 0
Ethernet II, Src: Micro-St_92:7c:77 (d8:bb:c1:92:7c:77), Dst: Sagemcom_fc:fd:c0 (98:42:65:fc:fd:c0)
Internet Protocol Version 4, Src: 192.168.2.49, Dst: 99.236.34.223
Transmission Control Protocol, Src Port: 18606, Dst Port: 50008, Seq: 1, Ack: 1, Len: 0

No.     Time           Source                Destination           Protocol Length Info
     41 3.665794       192.168.2.49          99.236.34.223         TCP      54     [TCP Dup ACK 40#1] 18606 → 50008 [ACK] Seq=1 Ack=1 Win=132096 Len=0

Frame 41: 54 bytes on wire (432 bits), 54 bytes captured (432 bits) on interface \Device\NPF_{F3023D06-108F-4190-A8B5-7A0A1D9213BD}, id 0
Ethernet II, Src: Micro-St_92:7c:77 (d8:bb:c1:92:7c:77), Dst: Sagemcom_fc:fd:c0 (98:42:65:fc:fd:c0)
Internet Protocol Version 4, Src: 192.168.2.49, Dst: 99.236.34.223
Transmission Control Protocol, Src Port: 18606, Dst Port: 50008, Seq: 1, Ack: 1, Len: 0

No.     Time           Source                Destination           Protocol Length Info
     42 3.673309       99.236.34.223         192.168.2.49          HTTP     553    HTTP/1.1 200 OK  (GIF89a)

Frame 42: 553 bytes on wire (4424 bits), 553 bytes captured (4424 bits) on interface \Device\NPF_{F3023D06-108F-4190-A8B5-7A0A1D9213BD}, id 0
Ethernet II, Src: Sagemcom_fc:fd:c0 (98:42:65:fc:fd:c0), Dst: Micro-St_92:7c:77 (d8:bb:c1:92:7c:77)
Internet Protocol Version 4, Src: 99.236.34.223, Dst: 192.168.2.49
Transmission Control Protocol, Src Port: 50008, Dst Port: 18604, Seq: 1347, Ack: 1065, Len: 499
Hypertext Transfer Protocol
Compuserve GIF, Version: GIF89a

No.     Time           Source                Destination           Protocol Length Info
     43 3.684880       99.236.34.223         192.168.2.49          TCP      60     50008 → 18605 [ACK] Seq=1 Ack=347 Win=64128 Len=0

Frame 43: 60 bytes on wire (480 bits), 60 bytes captured (480 bits) on interface \Device\NPF_{F3023D06-108F-4190-A8B5-7A0A1D9213BD}, id 0
Ethernet II, Src: Sagemcom_fc:fd:c0 (98:42:65:fc:fd:c0), Dst: Micro-St_92:7c:77 (d8:bb:c1:92:7c:77)
Internet Protocol Version 4, Src: 99.236.34.223, Dst: 192.168.2.49
Transmission Control Protocol, Src Port: 50008, Dst Port: 18605, Seq: 1, Ack: 347, Len: 0

No.     Time           Source                Destination           Protocol Length Info
     44 3.691747       99.236.34.223         192.168.2.49          HTTP     648    HTTP/1.1 200 OK  (GIF89a)

Frame 44: 648 bytes on wire (5184 bits), 648 bytes captured (5184 bits) on interface \Device\NPF_{F3023D06-108F-4190-A8B5-7A0A1D9213BD}, id 0
Ethernet II, Src: Sagemcom_fc:fd:c0 (98:42:65:fc:fd:c0), Dst: Micro-St_92:7c:77 (d8:bb:c1:92:7c:77)
Internet Protocol Version 4, Src: 99.236.34.223, Dst: 192.168.2.49
Transmission Control Protocol, Src Port: 50008, Dst Port: 18605, Seq: 1, Ack: 347, Len: 594
Hypertext Transfer Protocol
Compuserve GIF, Version: GIF89a

No.     Time           Source                Destination           Protocol Length Info
     45 3.697323       192.168.2.49          99.236.34.223         HTTP     395    GET /favicon.ico HTTP/1.1 

Frame 45: 395 bytes on wire (3160 bits), 395 bytes captured (3160 bits) on interface \Device\NPF_{F3023D06-108F-4190-A8B5-7A0A1D9213BD}, id 0
Ethernet II, Src: Micro-St_92:7c:77 (d8:bb:c1:92:7c:77), Dst: Sagemcom_fc:fd:c0 (98:42:65:fc:fd:c0)
Internet Protocol Version 4, Src: 192.168.2.49, Dst: 99.236.34.223
Transmission Control Protocol, Src Port: 18604, Dst Port: 50008, Seq: 1065, Ack: 1846, Len: 341
Hypertext Transfer Protocol

No.     Time           Source                Destination           Protocol Length Info
     46 3.697330       192.168.2.49          99.236.34.223         TCP      395    [TCP Retransmission] 18604 → 50008 [PSH, ACK] Seq=1065 Ack=1846 Win=132096 Len=341

Frame 46: 395 bytes on wire (3160 bits), 395 bytes captured (3160 bits) on interface \Device\NPF_{F3023D06-108F-4190-A8B5-7A0A1D9213BD}, id 0
Ethernet II, Src: Micro-St_92:7c:77 (d8:bb:c1:92:7c:77), Dst: Sagemcom_fc:fd:c0 (98:42:65:fc:fd:c0)
Internet Protocol Version 4, Src: 192.168.2.49, Dst: 99.236.34.223
Transmission Control Protocol, Src Port: 18604, Dst Port: 50008, Seq: 1065, Ack: 1846, Len: 341

No.     Time           Source                Destination           Protocol Length Info
     47 3.721812       99.236.34.223         192.168.2.49          HTTP     555    HTTP/1.1 404 Not Found  (text/html)

Frame 47: 555 bytes on wire (4440 bits), 555 bytes captured (4440 bits) on interface \Device\NPF_{F3023D06-108F-4190-A8B5-7A0A1D9213BD}, id 0
Ethernet II, Src: Sagemcom_fc:fd:c0 (98:42:65:fc:fd:c0), Dst: Micro-St_92:7c:77 (d8:bb:c1:92:7c:77)
Internet Protocol Version 4, Src: 99.236.34.223, Dst: 192.168.2.49
Transmission Control Protocol, Src Port: 50008, Dst Port: 18604, Seq: 1846, Ack: 1406, Len: 501
Hypertext Transfer Protocol
Line-based text data: text/html (9 lines)

No.     Time           Source                Destination           Protocol Length Info
     48 3.741855       192.168.2.49          99.236.34.223         TCP      54     18605 → 50008 [ACK] Seq=347 Ack=595 Win=131328 Len=0

Frame 48: 54 bytes on wire (432 bits), 54 bytes captured (432 bits) on interface \Device\NPF_{F3023D06-108F-4190-A8B5-7A0A1D9213BD}, id 0
Ethernet II, Src: Micro-St_92:7c:77 (d8:bb:c1:92:7c:77), Dst: Sagemcom_fc:fd:c0 (98:42:65:fc:fd:c0)
Internet Protocol Version 4, Src: 192.168.2.49, Dst: 99.236.34.223
Transmission Control Protocol, Src Port: 18605, Dst Port: 50008, Seq: 347, Ack: 595, Len: 0

No.     Time           Source                Destination           Protocol Length Info
     49 3.741867       192.168.2.49          99.236.34.223         TCP      54     [TCP Dup ACK 48#1] 18605 → 50008 [ACK] Seq=347 Ack=595 Win=131328 Len=0

Frame 49: 54 bytes on wire (432 bits), 54 bytes captured (432 bits) on interface \Device\NPF_{F3023D06-108F-4190-A8B5-7A0A1D9213BD}, id 0
Ethernet II, Src: Micro-St_92:7c:77 (d8:bb:c1:92:7c:77), Dst: Sagemcom_fc:fd:c0 (98:42:65:fc:fd:c0)
Internet Protocol Version 4, Src: 192.168.2.49, Dst: 99.236.34.223
Transmission Control Protocol, Src Port: 18605, Dst Port: 50008, Seq: 347, Ack: 595, Len: 0

No.     Time           Source                Destination           Protocol Length Info
     50 3.773423       192.168.2.49          99.236.34.223         TCP      54     18604 → 50008 [ACK] Seq=1406 Ack=2347 Win=131584 Len=0

Frame 50: 54 bytes on wire (432 bits), 54 bytes captured (432 bits) on interface \Device\NPF_{F3023D06-108F-4190-A8B5-7A0A1D9213BD}, id 0
Ethernet II, Src: Micro-St_92:7c:77 (d8:bb:c1:92:7c:77), Dst: Sagemcom_fc:fd:c0 (98:42:65:fc:fd:c0)
Internet Protocol Version 4, Src: 192.168.2.49, Dst: 99.236.34.223
Transmission Control Protocol, Src Port: 18604, Dst Port: 50008, Seq: 1406, Ack: 2347, Len: 0

No.     Time           Source                Destination           Protocol Length Info
     51 3.773431       192.168.2.49          99.236.34.223         TCP      54     [TCP Dup ACK 50#1] 18604 → 50008 [ACK] Seq=1406 Ack=2347 Win=131584 Len=0

Frame 51: 54 bytes on wire (432 bits), 54 bytes captured (432 bits) on interface \Device\NPF_{F3023D06-108F-4190-A8B5-7A0A1D9213BD}, id 0
Ethernet II, Src: Micro-St_92:7c:77 (d8:bb:c1:92:7c:77), Dst: Sagemcom_fc:fd:c0 (98:42:65:fc:fd:c0)
Internet Protocol Version 4, Src: 192.168.2.49, Dst: 99.236.34.223
Transmission Control Protocol, Src Port: 18604, Dst Port: 50008, Seq: 1406, Ack: 2347, Len: 0

No.     Time           Source                Destination           Protocol Length Info
     52 8.685946       99.236.34.223         192.168.2.49          TCP      60     50008 → 18605 [FIN, ACK] Seq=595 Ack=347 Win=64128 Len=0

Frame 52: 60 bytes on wire (480 bits), 60 bytes captured (480 bits) on interface \Device\NPF_{F3023D06-108F-4190-A8B5-7A0A1D9213BD}, id 0
Ethernet II, Src: Sagemcom_fc:fd:c0 (98:42:65:fc:fd:c0), Dst: Micro-St_92:7c:77 (d8:bb:c1:92:7c:77)
Internet Protocol Version 4, Src: 99.236.34.223, Dst: 192.168.2.49
Transmission Control Protocol, Src Port: 50008, Dst Port: 18605, Seq: 595, Ack: 347, Len: 0

No.     Time           Source                Destination           Protocol Length Info
     53 8.685978       192.168.2.49          99.236.34.223         TCP      54     18605 → 50008 [ACK] Seq=347 Ack=596 Win=131328 Len=0

Frame 53: 54 bytes on wire (432 bits), 54 bytes captured (432 bits) on interface \Device\NPF_{F3023D06-108F-4190-A8B5-7A0A1D9213BD}, id 0
Ethernet II, Src: Micro-St_92:7c:77 (d8:bb:c1:92:7c:77), Dst: Sagemcom_fc:fd:c0 (98:42:65:fc:fd:c0)
Internet Protocol Version 4, Src: 192.168.2.49, Dst: 99.236.34.223
Transmission Control Protocol, Src Port: 18605, Dst Port: 50008, Seq: 347, Ack: 596, Len: 0

No.     Time           Source                Destination           Protocol Length Info
     54 8.685984       192.168.2.49          99.236.34.223         TCP      54     [TCP Dup ACK 53#1] 18605 → 50008 [ACK] Seq=347 Ack=596 Win=131328 Len=0

Frame 54: 54 bytes on wire (432 bits), 54 bytes captured (432 bits) on interface \Device\NPF_{F3023D06-108F-4190-A8B5-7A0A1D9213BD}, id 0
Ethernet II, Src: Micro-St_92:7c:77 (d8:bb:c1:92:7c:77), Dst: Sagemcom_fc:fd:c0 (98:42:65:fc:fd:c0)
Internet Protocol Version 4, Src: 192.168.2.49, Dst: 99.236.34.223
Transmission Control Protocol, Src Port: 18605, Dst Port: 50008, Seq: 347, Ack: 596, Len: 0

No.     Time           Source                Destination           Protocol Length Info
     55 8.686016       192.168.2.49          99.236.34.223         TCP      54     18605 → 50008 [FIN, ACK] Seq=347 Ack=596 Win=131328 Len=0

Frame 55: 54 bytes on wire (432 bits), 54 bytes captured (432 bits) on interface \Device\NPF_{F3023D06-108F-4190-A8B5-7A0A1D9213BD}, id 0
Ethernet II, Src: Micro-St_92:7c:77 (d8:bb:c1:92:7c:77), Dst: Sagemcom_fc:fd:c0 (98:42:65:fc:fd:c0)
Internet Protocol Version 4, Src: 192.168.2.49, Dst: 99.236.34.223
Transmission Control Protocol, Src Port: 18605, Dst Port: 50008, Seq: 347, Ack: 596, Len: 0

No.     Time           Source                Destination           Protocol Length Info
     56 8.711593       99.236.34.223         192.168.2.49          TCP      60     50008 → 18605 [ACK] Seq=596 Ack=348 Win=64128 Len=0

Frame 56: 60 bytes on wire (480 bits), 60 bytes captured (480 bits) on interface \Device\NPF_{F3023D06-108F-4190-A8B5-7A0A1D9213BD}, id 0
Ethernet II, Src: Sagemcom_fc:fd:c0 (98:42:65:fc:fd:c0), Dst: Micro-St_92:7c:77 (d8:bb:c1:92:7c:77)
Internet Protocol Version 4, Src: 99.236.34.223, Dst: 192.168.2.49
Transmission Control Protocol, Src Port: 50008, Dst Port: 18605, Seq: 596, Ack: 348, Len: 0

No.     Time           Source                Destination           Protocol Length Info
     57 8.725536       99.236.34.223         192.168.2.49          TCP      60     50008 → 18604 [FIN, ACK] Seq=2347 Ack=1406 Win=64128 Len=0

Frame 57: 60 bytes on wire (480 bits), 60 bytes captured (480 bits) on interface \Device\NPF_{F3023D06-108F-4190-A8B5-7A0A1D9213BD}, id 0
Ethernet II, Src: Sagemcom_fc:fd:c0 (98:42:65:fc:fd:c0), Dst: Micro-St_92:7c:77 (d8:bb:c1:92:7c:77)
Internet Protocol Version 4, Src: 99.236.34.223, Dst: 192.168.2.49
Transmission Control Protocol, Src Port: 50008, Dst Port: 18604, Seq: 2347, Ack: 1406, Len: 0

No.     Time           Source                Destination           Protocol Length Info
     58 8.725570       192.168.2.49          99.236.34.223         TCP      54     18604 → 50008 [ACK] Seq=1406 Ack=2348 Win=131584 Len=0

Frame 58: 54 bytes on wire (432 bits), 54 bytes captured (432 bits) on interface \Device\NPF_{F3023D06-108F-4190-A8B5-7A0A1D9213BD}, id 0
Ethernet II, Src: Micro-St_92:7c:77 (d8:bb:c1:92:7c:77), Dst: Sagemcom_fc:fd:c0 (98:42:65:fc:fd:c0)
Internet Protocol Version 4, Src: 192.168.2.49, Dst: 99.236.34.223
Transmission Control Protocol, Src Port: 18604, Dst Port: 50008, Seq: 1406, Ack: 2348, Len: 0

No.     Time           Source                Destination           Protocol Length Info
     59 8.725578       192.168.2.49          99.236.34.223         TCP      54     [TCP Dup ACK 58#1] 18604 → 50008 [ACK] Seq=1406 Ack=2348 Win=131584 Len=0

Frame 59: 54 bytes on wire (432 bits), 54 bytes captured (432 bits) on interface \Device\NPF_{F3023D06-108F-4190-A8B5-7A0A1D9213BD}, id 0
Ethernet II, Src: Micro-St_92:7c:77 (d8:bb:c1:92:7c:77), Dst: Sagemcom_fc:fd:c0 (98:42:65:fc:fd:c0)
Internet Protocol Version 4, Src: 192.168.2.49, Dst: 99.236.34.223
Transmission Control Protocol, Src Port: 18604, Dst Port: 50008, Seq: 1406, Ack: 2348, Len: 0

No.     Time           Source                Destination           Protocol Length Info
     60 8.725611       192.168.2.49          99.236.34.223         TCP      54     18604 → 50008 [FIN, ACK] Seq=1406 Ack=2348 Win=131584 Len=0

Frame 60: 54 bytes on wire (432 bits), 54 bytes captured (432 bits) on interface \Device\NPF_{F3023D06-108F-4190-A8B5-7A0A1D9213BD}, id 0
Ethernet II, Src: Micro-St_92:7c:77 (d8:bb:c1:92:7c:77), Dst: Sagemcom_fc:fd:c0 (98:42:65:fc:fd:c0)
Internet Protocol Version 4, Src: 192.168.2.49, Dst: 99.236.34.223
Transmission Control Protocol, Src Port: 18604, Dst Port: 50008, Seq: 1406, Ack: 2348, Len: 0

No.     Time           Source                Destination           Protocol Length Info
     61 8.725616       192.168.2.49          99.236.34.223         TCP      54     [TCP Retransmission] 18604 → 50008 [FIN, ACK] Seq=1406 Ack=2348 Win=131584 Len=0

Frame 61: 54 bytes on wire (432 bits), 54 bytes captured (432 bits) on interface \Device\NPF_{F3023D06-108F-4190-A8B5-7A0A1D9213BD}, id 0
Ethernet II, Src: Micro-St_92:7c:77 (d8:bb:c1:92:7c:77), Dst: Sagemcom_fc:fd:c0 (98:42:65:fc:fd:c0)
Internet Protocol Version 4, Src: 192.168.2.49, Dst: 99.236.34.223
Transmission Control Protocol, Src Port: 18604, Dst Port: 50008, Seq: 1406, Ack: 2348, Len: 0

No.     Time           Source                Destination           Protocol Length Info
     62 8.751419       99.236.34.223         192.168.2.49          TCP      60     50008 → 18604 [ACK] Seq=2348 Ack=1407 Win=64128 Len=0

Frame 62: 60 bytes on wire (480 bits), 60 bytes captured (480 bits) on interface \Device\NPF_{F3023D06-108F-4190-A8B5-7A0A1D9213BD}, id 0
Ethernet II, Src: Sagemcom_fc:fd:c0 (98:42:65:fc:fd:c0), Dst: Micro-St_92:7c:77 (d8:bb:c1:92:7c:77)
